{"artifact_plan":{"created_at":"2026-09-05T00:00:00Z","identity":{"plan_id":"example-identity-offboarding-campaign","plan_sha256":"dbf36e323ebd25ceb44dd258aa0956efcb81cb3edb19950ccc1b48738c13d771"},"limitations":["plan_binds_every_active_declared_workload_to_reviewed_artifact_metadata_at_declared_nodes","spiffe_ids_are_identifiers_only_and_do_not_prove_svid_issuance_validation_or_possession","slsa_fields_are_a_bounded_projection_not_statement_signature_or_build-platform_verification","ai_bom_fields_are_a_bounded_projection_not_spdx_or_cyclonedx_document_validation","plan_validation_does_not_fetch_scan_load_import_execute_or_deserialize_artifact_bytes"],"nodes":[{"enforcement_point_id":"credential-broker","node_id":"identity-credential-broker"},{"enforcement_point_id":"policy-gateway","node_id":"identity-policy-gateway"}],"plan_id":"lurebom-conformance-source","policy":{"allowed_model_serializations":["onnx","safetensors"],"approved_builder_ids":["https://github.com/actions/runner"],"model_embedded_code_allowed":false,"provenance_required_for_roles":["container_image","model_weights","policy_bundle"],"remote_model_code_allowed":false,"required_artifact_roles":["ai_sbom","container_image","model_weights","policy_bundle"],"sbom_subject_roles":["container_image","model_weights","policy_bundle"]},"schema":"https://github.com/immu4989/lurebench/spec/lureartifact-plan-v1","schema_version":1,"standards":{"provenance_predicate_type":"https://slsa.dev/provenance/v1","statement_type":"https://in-toto.io/Statement/v1","supported_ai_bom_formats":["cyclonedx-1.6","cyclonedx-1.7","spdx-3.0.1"]},"system_id":"example-agent-system","workloads":[{"ai_bom":{"artifact_id":"alpha-ai-bom","document_sha256":"76bf0b73e6ac970642b97a87cbd405c8ead9f66fc818622cc8d74f2ef0240dd4","format":"spdx-3.0.1","subject_artifact_ids":["alpha-container","alpha-model","alpha-policy"]},"artifacts":[{"artifact_id":"alpha-ai-bom","media_type":"application/spdx+json","model_embedded_code":false,"model_serialization":null,"package_url":null,"remote_code_required":false,"role":"ai_sbom","sha256":"76bf0b73e6ac970642b97a87cbd405c8ead9f66fc818622cc8d74f2ef0240dd4"},{"artifact_id":"alpha-container","media_type":"application/vnd.oci.image.manifest.v1+json","model_embedded_code":false,"model_serialization":null,"package_url":"pkg:oci/example/lureagent-alpha@sha256:aaaaaaaaaaaaaaaaaaaaaaaaaaaaaaaaaaaaaaaaaaaaaaaaaaaaaaaaaaaaaaaa","remote_code_required":false,"role":"container_image","sha256":"aaaaaaaaaaaaaaaaaaaaaaaaaaaaaaaaaaaaaaaaaaaaaaaaaaaaaaaaaaaaaaaa"},{"artifact_id":"alpha-model","media_type":"application/vnd.safetensors","model_embedded_code":false,"model_serialization":"safetensors","package_url":"pkg:huggingface/example/model-alpha@0123456789abcdef","remote_code_required":false,"role":"model_weights","sha256":"bbbbbbbbbbbbbbbbbbbbbbbbbbbbbbbbbbbbbbbbbbbbbbbbbbbbbbbbbbbbbbbb"},{"artifact_id":"alpha-policy","media_type":"application/vnd.openpolicyagent.bundle","model_embedded_code":false,"model_serialization":null,"package_url":"pkg:generic/example/alpha-policy@1.0.0","remote_code_required":false,"role":"policy_bundle","sha256":"cccccccccccccccccccccccccccccccccccccccccccccccccccccccccccccccc"}],"attestations":[{"attestation_id":"alpha-container-provenance","build_type":"https://github.com/actions/runner/build/v1","builder_id":"https://github.com/actions/runner","predicate_type":"https://slsa.dev/provenance/v1","source_sha256":"1111111111111111111111111111111111111111111111111111111111111111","statement_sha256":"eeeeeeeeeeeeeeeeeeeeeeeeeeeeeeeeeeeeeeeeeeeeeeeeeeeeeeeeeeeeeeee","statement_type":"https://in-toto.io/Statement/v1","subject_artifact_id":"alpha-container","subject_sha256":"aaaaaaaaaaaaaaaaaaaaaaaaaaaaaaaaaaaaaaaaaaaaaaaaaaaaaaaaaaaaaaaa"},{"attestation_id":"alpha-model-provenance","build_type":"https://github.com/actions/runner/build/v1","builder_id":"https://github.com/actions/runner","predicate_type":"https://slsa.dev/provenance/v1","source_sha256":"2222222222222222222222222222222222222222222222222222222222222222","statement_sha256":"ffffffffffffffffffffffffffffffffffffffffffffffffffffffffffffffff","statement_type":"https://in-toto.io/Statement/v1","subject_artifact_id":"alpha-model","subject_sha256":"bbbbbbbbbbbbbbbbbbbbbbbbbbbbbbbbbbbbbbbbbbbbbbbbbbbbbbbbbbbbbbbb"},{"attestation_id":"alpha-policy-provenance","build_type":"https://github.com/actions/runner/build/v1","builder_id":"https://github.com/actions/runner","predicate_type":"https://slsa.dev/provenance/v1","source_sha256":"3333333333333333333333333333333333333333333333333333333333333333","statement_sha256":"0000000000000000000000000000000000000000000000000000000000000000","statement_type":"https://in-toto.io/Statement/v1","subject_artifact_id":"alpha-policy","subject_sha256":"cccccccccccccccccccccccccccccccccccccccccccccccccccccccccccccccc"}],"node_ids":["identity-credential-broker","identity-policy-gateway"],"spiffe_id":"spiffe://example.com/agents/alpha","workload_principal_id":"workload-alpha"}]},"components":[{"artifact_binding_match":true,"artifact_id":null,"component_id":"alpha-base-model","cyclonedx_package_url":"pkg:huggingface/example/base-model@89abcdef01234567","cyclonedx_ref":"urn:lurebom:cyclonedx:alpha-base-model","cyclonedx_sha256":"9999999999999999999999999999999999999999999999999999999999999999","kind":"model","kind_match":true,"package_url_match":true,"sha256_match":true,"spdx_id":"urn:lurebom:spdx:alpha-base-model","spdx_package_url":"pkg:huggingface/example/base-model@89abcdef01234567","spdx_sha256":"9999999999999999999999999999999999999999999999999999999999999999"},{"artifact_binding_match":true,"artifact_id":"alpha-container","component_id":"alpha-container-root","cyclonedx_package_url":"pkg:oci/example/lureagent-alpha@sha256:aaaaaaaaaaaaaaaaaaaaaaaaaaaaaaaaaaaaaaaaaaaaaaaaaaaaaaaaaaaaaaaa","cyclonedx_ref":"urn:lurebom:cyclonedx:alpha-container","cyclonedx_sha256":"aaaaaaaaaaaaaaaaaaaaaaaaaaaaaaaaaaaaaaaaaaaaaaaaaaaaaaaaaaaaaaaa","kind":"container","kind_match":true,"package_url_match":true,"sha256_match":true,"spdx_id":"urn:lurebom:spdx:alpha-container","spdx_package_url":"pkg:oci/example/lureagent-alpha@sha256:aaaaaaaaaaaaaaaaaaaaaaaaaaaaaaaaaaaaaaaaaaaaaaaaaaaaaaaaaaaaaaaa","spdx_sha256":"aaaaaaaaaaaaaaaaaaaaaaaaaaaaaaaaaaaaaaaaaaaaaaaaaaaaaaaaaaaaaaaa"},{"artifact_binding_match":true,"artifact_id":"alpha-model","component_id":"alpha-model-root","cyclonedx_package_url":"pkg:huggingface/example/model-alpha@0123456789abcdef","cyclonedx_ref":"urn:lurebom:cyclonedx:alpha-model","cyclonedx_sha256":"bbbbbbbbbbbbbbbbbbbbbbbbbbbbbbbbbbbbbbbbbbbbbbbbbbbbbbbbbbbbbbbb","kind":"model","kind_match":true,"package_url_match":true,"sha256_match":true,"spdx_id":"urn:lurebom:spdx:alpha-model","spdx_package_url":"pkg:huggingface/example/model-alpha@0123456789abcdef","spdx_sha256":"bbbbbbbbbbbbbbbbbbbbbbbbbbbbbbbbbbbbbbbbbbbbbbbbbbbbbbbbbbbbbbbb"},{"artifact_binding_match":true,"artifact_id":"alpha-policy","component_id":"alpha-policy-root","cyclonedx_package_url":"pkg:generic/example/alpha-policy@1.0.0","cyclonedx_ref":"urn:lurebom:cyclonedx:alpha-policy","cyclonedx_sha256":"cccccccccccccccccccccccccccccccccccccccccccccccccccccccccccccccc","kind":"policy","kind_match":true,"package_url_match":true,"sha256_match":true,"spdx_id":"urn:lurebom:spdx:alpha-policy","spdx_package_url":"pkg:generic/example/alpha-policy@1.0.0","spdx_sha256":"cccccccccccccccccccccccccccccccccccccccccccccccccccccccccccccccc"}],"dependencies":{"cyclonedx":[{"dependency_component_id":"alpha-base-model","dependent_component_id":"alpha-model-root"}],"spdx":[{"dependency_component_id":"alpha-base-model","dependent_component_id":"alpha-model-root"}]},"engine":{"name":"lurebench-lurebom-reference","version":"1.0.0"},"evaluated_at":"2026-09-05T00:03:00Z","evaluation_id":"lurebom-conformance-evaluation","findings":[],"limitations":["projection_loss_lists_ignored_fields_but_does_not_interpret_their_semantics","source_documents_are_strictly_parsed_but_not_fully_validated_against_official_schemas","matching_metadata_does_not_establish_bom_completeness_authenticity_freshness_or_truth","no_artifact_model_container_policy_dataset_package_or_external_reference_is_opened","a_pass_is_not_vulnerability_license_safety_compliance_procurement_or_deployment_approval"],"manifest":{"artifact_plan_sha256":"5e64f9391bc65f333641d0246b879d020dc7ac4dc2948432cd8211833c87636b","components":[{"artifact_id":null,"component_id":"alpha-base-model","cyclonedx_ref":"urn:lurebom:cyclonedx:alpha-base-model","kind":"model","spdx_id":"urn:lurebom:spdx:alpha-base-model"},{"artifact_id":"alpha-container","component_id":"alpha-container-root","cyclonedx_ref":"urn:lurebom:cyclonedx:alpha-container","kind":"container","spdx_id":"urn:lurebom:spdx:alpha-container"},{"artifact_id":"alpha-model","component_id":"alpha-model-root","cyclonedx_ref":"urn:lurebom:cyclonedx:alpha-model","kind":"model","spdx_id":"urn:lurebom:spdx:alpha-model"},{"artifact_id":"alpha-policy","component_id":"alpha-policy-root","cyclonedx_ref":"urn:lurebom:cyclonedx:alpha-policy","kind":"policy","spdx_id":"urn:lurebom:spdx:alpha-policy"}],"created_at":"2026-09-05T00:02:00Z","cyclonedx_document_sha256":"2d8ee763f2b4dcf5c7d0b3353ab569295fc3069f6cd8919b54389ce1314f242d","limitations":["component_identity_is_explicitly_reviewed_and_never_inferred_from_names_or_versions","only_sha256_package_url_component_class_and_directed_dependson_edges_are_compared","the_primary_bom_digest_is_bound_to_lureartifact_while_the_mirror_digest_is_manifest_bound","the_manifest_does_not_authenticate_bom_issuers_or_establish_source_document_conformance"],"policy":{"require_all_components_mapped":true,"require_artifact_subject_coverage":true,"require_dependency_parity":true,"require_package_url_parity":true,"require_sha256_parity":true},"primary_format":"spdx-3.0.1","reconciliation_id":"lurebom-conformance","schema":"https://github.com/immu4989/lurebench/spec/lurebom-manifest-v1","schema_version":1,"spdx_document_